{
  "$schema": "../contracts/v1/publication-architecture.schema.json",
  "schema": "identity.publication-architecture/v1",
  "status": "accepted",
  "decision": "docs/decisions/ADR-0017-zensical-launchkit-publication-architecture.md",
  "scope": {
    "repository": "https://github.com/egohygiene/identity",
    "experienceCanonicalUrl": "https://egohygiene.io/identity/",
    "brandKitCanonicalUrl": "https://identity.egohygiene.io/",
    "organizationHomepageOwnedHere": false
  },
  "adapters": [
    {
      "id": "launchkit",
      "role": "landing",
      "implementationOwner": "egohygiene/holon",
      "status": "available",
      "canonicalBrandSource": false,
      "pin": {
        "repository": "https://github.com/egohygiene/holon",
        "commit": "2600baff6f6d944094da81b77e1a9a2e9e7a1cd6",
        "profile": "landing-launchkit",
        "version": "1.0.0",
        "path": "blueprints/launchkit/blueprint.json",
        "gitBlob": "3629339d25facb1e5b36cf6ab381c0744f1e3a14"
      }
    },
    {
      "id": "zensical",
      "role": "documentation",
      "implementationOwner": "egohygiene/holon",
      "status": "available",
      "canonicalBrandSource": false,
      "pin": {
        "repository": "https://github.com/egohygiene/holon",
        "commit": "2600baff6f6d944094da81b77e1a9a2e9e7a1cd6",
        "profile": "docs-zensical",
        "version": "1.0.0",
        "path": "blueprints/zensical/blueprint.json",
        "gitBlob": "5f6e385d54d6271c7fe89f441787d6b253cf9fb0",
        "upstreamRepository": "https://github.com/zensical/zensical",
        "upstreamVersion": "0.0.57",
        "upstreamTag": "v0.0.57",
        "upstreamTagObject": "ad8188ee60ae9187d64a4fe7c4970d3a1947028d",
        "upstreamCommit": "f18bb9957cb2740e5dd66d4a438c780b4e15d64c",
        "license": "MIT",
        "developmentStatus": "alpha"
      }
    },
    {
      "id": "reference-renderer",
      "role": "brand-kit-renderer",
      "implementationOwner": "egohygiene/identity",
      "status": "existing",
      "canonicalBrandSource": false,
      "pin": {
        "source": "renderer/",
        "configuration": "publication/identity-brand-kit.config.json",
        "releaseBacked": true
      }
    },
    {
      "id": "route-composer",
      "role": "publication-composer",
      "implementationOwner": "egohygiene/identity",
      "status": "dogfood-adapter",
      "canonicalBrandSource": false,
      "pin": {
        "repository": "https://github.com/egohygiene/holon",
        "commit": "2600baff6f6d944094da81b77e1a9a2e9e7a1cd6",
        "profile": "site-suite",
        "version": "1.0.0",
        "path": "blueprints/site-suite/blueprint.json",
        "gitBlob": "2635781f74fd1ba5ee5e6d742dcfabdd0289606b",
        "input": "content-addressed-identity-experience-artifact",
        "publicationOwner": "egohygiene/relay",
        "networkAtBuild": false
      }
    }
  ],
  "artifacts": [
    {
      "id": "identity-landing",
      "owner": "launchkit",
      "host": "organization",
      "basePath": "/identity/",
      "inputs": ["compiled-identity", "authored-product-copy", "adapter-configuration"],
      "rollback": "Promote the preceding verified landing artifact without rebuilding it."
    },
    {
      "id": "identity-documentation",
      "owner": "zensical",
      "host": "organization",
      "basePath": "/identity/docs/",
      "inputs": ["compiled-identity", "authored-documentation", "adapter-configuration"],
      "rollback": "Promote the preceding verified documentation artifact without rebuilding it."
    },
    {
      "id": "identity-architecture",
      "owner": "zensical",
      "host": "organization",
      "basePath": "/identity/architecture/",
      "inputs": ["compiled-identity", "authored-documentation", "adapter-configuration"],
      "rollback": "Promote the preceding verified architecture artifact without rebuilding it."
    },
    {
      "id": "identity-legal",
      "owner": "zensical",
      "host": "organization",
      "basePath": "/identity/legal/",
      "inputs": ["compiled-identity", "authored-documentation", "adapter-configuration"],
      "rollback": "Promote the preceding verified legal projection without rebuilding it."
    },
    {
      "id": "identity-experience",
      "owner": "route-composer",
      "host": "organization",
      "basePath": "/identity/",
      "inputs": [
        "identity-landing",
        "identity-documentation",
        "identity-architecture",
        "identity-legal"
      ],
      "rollback": "Reinstall the preceding content-addressed composite and verify its publication manifest."
    },
    {
      "id": "identity-brand-kit",
      "owner": "reference-renderer",
      "host": "brand-kit",
      "basePath": "/",
      "inputs": ["compiled-identity"],
      "rollback": "Run the Brand Kit publisher for an earlier published stable annotated Identity tag."
    }
  ],
  "contentSources": [
    {
      "id": "compiled-identity",
      "class": "compiled-identity",
      "authority": "identity-contracts",
      "paths": [
        "assets/identity/manifest.json",
        "assets/identity/mascot/manifest.json",
        "assets/identity/web/identity-palette.css"
      ],
      "consumption": "read-only",
      "mustExist": true
    },
    {
      "id": "authored-documentation",
      "class": "authored-documentation",
      "authority": "identity-maintainers",
      "paths": [
        "README.md",
        "CHANGELOG.md",
        "docs/contracts/",
        "docs/publication/",
        "docs/releases/"
      ],
      "consumption": "render-markdown",
      "mustExist": true
    },
    {
      "id": "authored-product-copy",
      "class": "authored-product-copy",
      "authority": "identity-maintainers",
      "paths": [
        "publication/identity-experience.content.json"
      ],
      "consumption": "reviewed-input",
      "mustExist": true
    },
    {
      "id": "adapter-configuration",
      "class": "adapter-configuration",
      "authority": "adapter-only",
      "paths": [
        "experience/"
      ],
      "consumption": "references-only",
      "mustExist": true
    }
  ],
  "routes": [
    {
      "id": "organization-identity",
      "host": "organization",
      "path": "/identity/",
      "kind": "page",
      "owner": "launchkit",
      "adapter": "launchkit",
      "artifact": "identity-landing",
      "status": "handoff-ready"
    },
    {
      "id": "organization-identity-noslash",
      "host": "organization",
      "path": "/identity",
      "kind": "redirect",
      "owner": "route-composer",
      "target": "https://egohygiene.io/identity/",
      "status": "handoff-ready"
    },
    {
      "id": "organization-identity-docs",
      "host": "organization",
      "path": "/identity/docs/",
      "kind": "page",
      "owner": "zensical",
      "adapter": "zensical",
      "artifact": "identity-documentation",
      "status": "handoff-ready"
    },
    {
      "id": "organization-identity-architecture",
      "host": "organization",
      "path": "/identity/architecture/",
      "kind": "page",
      "owner": "zensical",
      "adapter": "zensical",
      "artifact": "identity-architecture",
      "status": "handoff-ready"
    },
    {
      "id": "organization-identity-legal",
      "host": "organization",
      "path": "/identity/legal/",
      "kind": "page",
      "owner": "zensical",
      "adapter": "zensical",
      "artifact": "identity-legal",
      "status": "handoff-ready"
    },
    {
      "id": "organization-identity-manifest",
      "host": "organization",
      "path": "/identity/publication.json",
      "kind": "manifest",
      "owner": "route-composer",
      "artifact": "identity-experience",
      "status": "handoff-ready"
    },
    {
      "id": "organization-identity-brand-kit",
      "host": "organization",
      "path": "/identity/brand-kit/",
      "kind": "redirect",
      "owner": "route-composer",
      "target": "https://identity.egohygiene.io/",
      "status": "handoff-ready"
    },
    {
      "id": "organization-brand-alias",
      "host": "organization",
      "path": "/brand/",
      "kind": "redirect",
      "owner": "route-composer",
      "target": "https://identity.egohygiene.io/",
      "status": "handoff-ready"
    },
    {
      "id": "organization-design-alias",
      "host": "organization",
      "path": "/design/",
      "kind": "redirect",
      "owner": "route-composer",
      "target": "https://identity.egohygiene.io/",
      "status": "handoff-ready"
    },
    {
      "id": "organization-brand-kit-alias",
      "host": "organization",
      "path": "/brand-kit/",
      "kind": "redirect",
      "owner": "route-composer",
      "target": "https://identity.egohygiene.io/",
      "status": "handoff-ready"
    },
    {
      "id": "brand-kit-root",
      "host": "brand-kit",
      "path": "/",
      "kind": "page",
      "owner": "reference-renderer",
      "adapter": "reference-renderer",
      "artifact": "identity-brand-kit",
      "status": "existing"
    },
    {
      "id": "brand-kit-site-manifest",
      "host": "brand-kit",
      "path": "/site.json",
      "kind": "manifest",
      "owner": "reference-renderer",
      "artifact": "identity-brand-kit",
      "status": "existing"
    },
    {
      "id": "brand-kit-release-manifest",
      "host": "brand-kit",
      "path": "/packages/identity-brand-kit-v{version}.manifest.json",
      "kind": "manifest",
      "owner": "reference-renderer",
      "artifact": "identity-brand-kit",
      "status": "existing"
    },
    {
      "id": "brand-kit-release-download",
      "host": "brand-kit",
      "path": "/packages/identity-brand-kit-v{version}.zip",
      "kind": "download",
      "owner": "reference-renderer",
      "artifact": "identity-brand-kit",
      "status": "existing"
    },
    {
      "id": "brand-kit-release-checksums",
      "host": "brand-kit",
      "path": "/packages/identity-brand-kit-v{version}.SHA256SUMS",